{
  "schema_version": 1,
  "report_type": "neighbors",
  "policy": {
    "read_only": true,
    "tracker_mutation_allowed": false,
    "advisory": true,
    "notice": "Synthetic read-only example. Verify advisory evidence against current project state."
  },
  "snapshot": {
    "workspace_id": "synthetic-workspace",
    "beads_version": "1.0.5",
    "workspace_path": null
  },
  "model": {
    "model_id": "synthetic-local-model",
    "model_revision": "example-revision"
  },
  "cache": {
    "hits": 2,
    "misses": 0
  },
  "issue": {
    "id": "demo-1",
    "title": "Document token refresh",
    "status": "open",
    "priority": 2,
    "labels": [
      "documentation"
    ],
    "parent_id": "demo-epic",
    "dependencies": []
  },
  "neighbors": [
    {
      "id": "demo-2",
      "title": "Implement token refresh",
      "status": "closed",
      "priority": 1,
      "labels": [
        "auth"
      ],
      "parent_id": "demo-epic",
      "dependencies": [],
      "similarity": 0.91,
      "rank": 1,
      "reverse_rank": 2,
      "structural_context": "same parent demo-epic",
      "text_claims": [],
      "assignee": null,
      "guards": [],
      "last_human_touch": "2026-07-01T00:00:00Z",
      "close_reason": "Duplicate of demo-1",
      "duplicate_direction": "neighbor_dup_of_seed"
    }
  ],
  "score_baseline": {
    "population": 3,
    "p50": 0.41,
    "p90": 0.62,
    "p99": 0.62
  },
  "dropped": {
    "seed": 0,
    "sibling": 0,
    "soft_link": 0,
    "structural_link": 0
  }
}
